{
  "bodyTypeName": "male",
  "url": "https://sanderfrenken.github.io/Universal-LPC-Spritesheet-Character-Generator/#?body=Body_color_light&head=Human_male_light&sex=male&shadow=none&wound_arm=Arm_arm&ammo=Ammo_arrow&weapon=Normal_normal&clothes=Longsleeve_blue&shoes=Boots_bluegray&hair=Page_chestnut",
  "spritesheets": "https://sanderfrenken.github.io/Universal-LPC-Spritesheet-Character-Generator/spritesheets/",
  "version": 1,
  "datetime": "18.10.2023, 17:23:37",
  "credits": "Authors: bluecarrot16, Benjamin K. Smith (BenCreating), Evert, Eliza Wyatt (ElizaWy), TheraHedwig, MuffinElZangano, Durrani, Johannes Sj?lund (wulax), Stephen Challener (Redshrike), Sander Frenken (castelonia), Johannes Sjölund (wulax), David Conway Jr. (JaidynReiman), Nila122, , pvigier\n\n- body/bodies/male/universal/light.png: by bluecarrot16, Benjamin K. Smith (BenCreating), Evert, Eliza Wyatt (ElizaWy), TheraHedwig, MuffinElZangano, Durrani, Johannes Sj?lund (wulax), Stephen Challener (Redshrike). License(s): CC-BY-SA 3.0, GPL 3.0. \n    - https://opengameart.org/content/liberated-pixel-cup-lpc-base-assets-sprites-map-tiles\n    - https://opengameart.org/content/lpc-medieval-fantasy-character-sprites\n    - https://opengameart.org/content/lpc-male-jumping-animation-by-durrani\n    - https://opengameart.org/content/lpc-runcycle-and-diagonal-walkcycle\n    - https://opengameart.org/content/lpc-revised-character-basics\n\n- body/wound/arm.png: by Benjamin K. Smith (BenCreating), Sander Frenken (castelonia). License(s): CC-BY-SA 3.0, GPL 3.0. \n    - https://opengameart.org/content/lpc-zombie\n\n- head/heads/human_male/universal/light.png: by bluecarrot16, Benjamin K. Smith (BenCreating), Stephen Challener (Redshrike). License(s): OGA-BY 3.0, CC-BY-SA 3.0, GPL 3.0. \n    - https://opengameart.org/content/liberated-pixel-cup-lpc-base-assets-sprites-map-tiles\n    - https://opengameart.org/content/lpc-character-bases\n\n- hair/page/male/chestnut.png: by Johannes Sjölund (wulax). License(s): CC-BY-SA 3.0, GPL 3.0. \n    - https://opengameart.org/content/lpc-medieval-fantasy-character-sprites\n\n- torso/clothes/longsleeve/male/blue.png: by David Conway Jr. (JaidynReiman), Johannes Sjölund (wulax). License(s): CC-BY-SA 3.0, GPL 3.0. \n    - https://opengameart.org/content/lpc-medieval-fantasy-character-sprites\n    - http://opengameart.org/content/lpc-clothing-updates\n\n- feet/boots/male/bluegray.png: by bluecarrot16, Nila122. License(s): CC-BY-SA 3.0, GPL 2.0, GPL 3.0. \n    - https://opengameart.org/content/lpc-clothes-and-hair\n    - https://opengameart.org/content/lpc-santa\n    - http://opengameart.org/content/lpc-clothing-updates\n\n- weapon/ranged/bow/arrow/arrow.png: by Johannes Sjölund (wulax). License(s): CC-BY-SA 3.0, GPL 3.0. \n    - https://opengameart.org/content/lpc-medieval-fantasy-character-sprites\n\n- weapon/ranged/bow/normal/normal.png: by . License(s): . !MISSING LICENSE INFORMATION! PLEASE CORRECT MANUALY AND REPORT BACK VIA A GITHUB ISSUE\n\n- weapon/ranged/bow/normal/walk/background/normal.png: by Johannes Sjölund (wulax), pvigier. License(s): CC-BY-SA 3.0, GPL 3.0. \n    - https://opengameart.org/content/lpc-medieval-fantasy-character-sprites\n    - https://opengameart.org/content/lpc-walk-animations-for-bows\n\n- weapon/ranged/bow/normal/walk/foreground/normal.png: by . License(s): . !MISSING LICENSE INFORMATION! PLEASE CORRECT MANUALY AND REPORT BACK VIA A GITHUB ISSUE",
  "layers": [
    {
      "fileName": "weapon/ranged/bow/normal/walk/background/normal.png",
      "zPos": -1,
      "custom_animation": "walk_128",
      "parentName": "weapon",
      "name": "Normal",
      "variant": "normal"
    },
    {
      "fileName": "body/bodies/male/universal/light.png",
      "zPos": 10,
      "parentName": "body",
      "name": "Body color",
      "variant": "light"
    },
    {
      "fileName": "body/wound/arm.png",
      "zPos": 15,
      "parentName": "wound_arm",
      "name": "Arm",
      "variant": "arm"
    },
    {
      "fileName": "feet/boots/male/bluegray.png",
      "zPos": 25,
      "parentName": "shoes",
      "name": "Boots",
      "variant": "bluegray"
    },
    {
      "fileName": "torso/clothes/longsleeve/male/blue.png",
      "zPos": 35,
      "parentName": "clothes",
      "name": "Longsleeve",
      "variant": "blue"
    },
    {
      "fileName": "head/heads/human_male/universal/light.png",
      "zPos": 100,
      "parentName": "head",
      "name": "Human male",
      "variant": "light"
    },
    {
      "fileName": "hair/page/male/chestnut.png",
      "zPos": 120,
      "parentName": "hair",
      "name": "Page",
      "variant": "chestnut"
    },
    {
      "fileName": "weapon/ranged/bow/normal/normal.png",
      "zPos": 140,
      "parentName": "weapon",
      "name": "Normal",
      "variant": "normal"
    },
    {
      "fileName": "weapon/ranged/bow/normal/walk/foreground/normal.png",
      "zPos": 141,
      "custom_animation": "walk_128",
      "parentName": "weapon",
      "name": "Normal",
      "variant": "normal"
    },
    {
      "fileName": "weapon/ranged/bow/arrow/arrow.png",
      "zPos": 150,
      "parentName": "ammo",
      "name": "Ammo",
      "variant": "arrow"
    }
  ]
}